{
  "item": {
    "description": "Bolt / Nut / Washer set for structural steel connection (stud bolt + heavy hex nut + flat washer)",
    "quantity": 500,
    "specs": "ASTM A193 B7 stud bolt, ASTM A194 2H heavy hex nut, ASTM F436 washer, M20, Hot-Dip Galvanized"
  },
  "internalCheck": {
    "searched": true,
    "matched": []
  },
  "vendorShortlist": [
    {
      "id": "",
      "name": "Alpha Fastener JSC (Bulong Alpha)",
      "source": "external",
      "type": "High-strength / anchor bolts, ASTM A193 bolts (made in Vietnam)",
      "location": "Vietnam",
      "contact": "",
      "standards": ["ASTM A193"],
      "matchScore": "high",
      "retrievedVia": "firecrawl",
      "url": "https://bulongalpha.vn/en/astm-a193-bolt/"
    },
    {
      "id": "",
      "name": "Bulong Quang Thai",
      "source": "external",
      "type": "Stud bolt + heavy hex nut + washer set",
      "location": "Vietnam",
      "contact": "0933220468",
      "standards": ["ASTM A193 B7", "ASTM A194 2H", "ASTM F436"],
      "matchScore": "high",
      "retrievedVia": "firecrawl",
      "url": "https://bulongquangthai.vn/stud-bolt-astm-a193-b7-nuts-2h-washers-f436"
    },
    {
      "id": "",
      "name": "Saigon Kinh Bac (SKB)",
      "source": "external",
      "type": "Stud bolt ASTM A193 / A194",
      "location": "Ho Chi Minh City",
      "contact": "02866601010 / info@skb.vn",
      "standards": ["ASTM A193", "ASTM A194"],
      "matchScore": "high",
      "retrievedVia": "firecrawl",
      "url": "https://www.skb.com.vn/en/stud-bolt-astm-a193-astm-a194.html"
    },
    {
      "id": "",
      "name": "VETCO",
      "source": "external",
      "type": "Stud bolts A193 Gr B7 / heavy hex nut A194 Gr 2H (Corroshield PTFE option)",
      "location": "Ba Ria - Vung Tau",
      "contact": "0254 3526 619 / info@vetco.com.vn",
      "standards": ["ASTM A193 Gr B7", "ASTM A194 Gr 2H"],
      "matchScore": "high",
      "retrievedVia": "firecrawl",
      "url": "https://vetco.com.vn/en/products-services/stud-bolts-astm-a193-gr-b7-heavy-hex-nut-astm-a194-gr-2h-corroshield-ptfe-blue.html"
    }
  ],
  "rfqDraft": {
    "subject": "RFQ: ASTM A193 B7 stud bolt + A194 2H nut + F436 washer (M20, HDG) - 500 sets",
    "body": "Kinh gui Quy cong ty, Chung toi can bang gia cho hang muc lien ket ket cau (500 bo):\n- Stud bolt ASTM A193 Gr B7, M20 x chieu dai (can xac nhan), Hot-Dip Galvanized\n- Heavy hex nut ASTM A194 Gr 2H, M20, HDG\n- Flat washer ASTM F436, M20, HDG\nTieu chuan/Chung nhan: yeu cau chung nhan vat lieu (MTC) va thu nghiem. Vui long cung cap: don gia, MOQ, lead time, dieu kien giao hang, va tai lieu chung nhan.",
    "recipients": [
      "Alpha Fastener JSC (bulongalpha.vn)",
      "Bulong Quang Thai (bulongquangthai.vn)",
      "Saigon Kinh Bac (skb.com.vn)",
      "VETCO (vetco.com.vn)"
    ],
    "lineItems": [
      "ASTM A193 B7 stud bolt M20 - 500 pcs",
      "ASTM A194 2H heavy hex nut M20 - 500 pcs",
      "ASTM F436 flat washer M20 - 500 pcs"
    ]
  },
  "comparison": [
    {
      "vendor": "Alpha Fastener JSC (Bulong Alpha)",
      "standards": "ASTM A193 (made in Vietnam)",
      "certs": "can RFQ",
      "leadTime": "can RFQ",
      "moq": "can RFQ",
      "priceIndication": "can RFQ",
      "notes": "Nha san xuat bulong tai Vietnam, trang san pham A193 rieng."
    },
    {
      "vendor": "Bulong Quang Thai",
      "standards": "ASTM A193 B7 + A194 2H + F436 (dung bo)",
      "certs": "can RFQ",
      "leadTime": "can RFQ",
      "moq": "can RFQ",
      "priceIndication": "can RFQ",
      "notes": "Co trang san pham dung bo stud bolt B7 + nut 2H + washer F436 - khop 100% yeu cau."
    },
    {
      "vendor": "Saigon Kinh Bac (SKB)",
      "standards": "ASTM A193 / A194",
      "certs": "can RFQ",
      "leadTime": "can RFQ",
      "moq": "can RFQ",
      "priceIndication": "can RFQ",
      "notes": "TP.HCM, co lien he ro (hotline + email)."
    },
    {
      "vendor": "VETCO",
      "standards": "ASTM A193 Gr B7 / A194 Gr 2H",
      "certs": "can RFQ",
      "leadTime": "can RFQ",
      "moq": "can RFQ",
      "priceIndication": "can RFQ",
      "notes": "Vung Tau; co option phu Corroshield PTFE cho moi truong an mon cao."
    }
  ],
  "recommendation": {
    "vendor": "Bulong Quang Thai",
    "reason": "La NCC duy nhat trong shortlist co trang san pham dung bo A193 B7 + nut A194 2H + washer F436 (khop 100% spec yeu cau), tai Vietnam, co lien he truc tiep. Giam rui ro thieu hang muc trong bo.",
    "alternatives": ["Alpha Fastener JSC (Bulong Alpha)", "Saigon Kinh Bac (SKB)", "VETCO"],
    "caveats": "Can RFQ chinh thuc de xac nhan gia/lead time/MOQ va chung nhan vat lieu (MTC) + HDG. Neu can chong an mon cao, VETCO co option Corroshield PTFE. Chua co NCC noi bo khop A193/A194 nen dung external search (firecrawl)."
  }
}
